{
  "frozen_at": "2026-10-09",
  "taxonomy": "v1",
  "cells": [
    {
      "id": "loudoun-ip-datacenter",
      "jurisdiction_id": "us-51107",
      "district_code": "IP",
      "use_class": "datacenter",
      "expected_status": "conditional",
      "basis": "adopted_amendment",
      "citation": {
        "url": "https://www.loudoun.gov/6221/Phase-1-Project-Plan-for-Data-Center-Sta",
        "quote": "requiring Special Exception (SPEX) approval for data center uses in the Industrial Park (IP), General Industry (GI), and Mineral Resources-Heavy Industry (MR-HI) zoning districts"
      },
      "quote_verified": true,
      "source_text_status": "permitted",
      "notes": "Amended after the source: the county's own 2023 ordinance PDF (Table 3.02.05-1) shows P; ZOAM-2024-0001, adopted 2025-03-18, requires a special exception. Applications accepted before 2025-02-12 are grandfathered."
    },
    {
      "id": "loudoun-gi-datacenter",
      "jurisdiction_id": "us-51107",
      "district_code": "GI",
      "use_class": "datacenter",
      "expected_status": "conditional",
      "basis": "adopted_amendment",
      "citation": {
        "url": "https://www.loudoun.gov/6221/Phase-1-Project-Plan-for-Data-Center-Sta",
        "quote": "requiring Special Exception (SPEX) approval for data center uses in the Industrial Park (IP), General Industry (GI), and Mineral Resources-Heavy Industry (MR-HI) zoning districts"
      },
      "quote_verified": true,
      "source_text_status": "permitted",
      "notes": "Amended after the source: the county's own 2023 ordinance PDF (Table 3.02.05-1) shows P; ZOAM-2024-0001, adopted 2025-03-18, requires a special exception. Applications accepted before 2025-02-12 are grandfathered."
    },
    {
      "id": "loudoun-mrhi-datacenter",
      "jurisdiction_id": "us-51107",
      "district_code": "MRHI",
      "use_class": "datacenter",
      "expected_status": "conditional",
      "basis": "adopted_amendment",
      "citation": {
        "url": "https://www.loudoun.gov/6221/Phase-1-Project-Plan-for-Data-Center-Sta",
        "quote": "requiring Special Exception (SPEX) approval for data center uses in the Industrial Park (IP), General Industry (GI), and Mineral Resources-Heavy Industry (MR-HI) zoning districts"
      },
      "quote_verified": true,
      "source_text_status": "permitted",
      "notes": "Amended after the source: the county's own 2023 ordinance PDF (Table 3.02.05-1) shows P; ZOAM-2024-0001, adopted 2025-03-18, requires a special exception. Applications accepted before 2025-02-12 are grandfathered."
    },
    {
      "id": "pittsylvania-m-2-datacenter",
      "jurisdiction_id": "us-51143",
      "district_code": "M-2",
      "use_class": "datacenter",
      "expected_status": "conditional",
      "basis": "code_text",
      "citation": {
        "url": "https://www.pittsylvaniacountyva.gov/DocumentCenter/View/1268/Chapter-35---Zoning-PDF",
        "quote": "The following uses shall be permitted only by special use permit:",
        "section": "Sec. 35-403"
      },
      "quote_verified": true,
      "notes": "Lead-in of Sec. 35-403 (Division 12, M-2 Heavy Industry); its list includes the bullet 'Data centers'."
    },
    {
      "id": "pittsylvania-m-svms-datacenter",
      "jurisdiction_id": "us-51143",
      "district_code": "M-SVMS",
      "use_class": "datacenter",
      "expected_status": "permitted",
      "basis": "code_text",
      "citation": {
        "url": "https://www.pittsylvaniacountyva.gov/DocumentCenter/View/1268/Chapter-35---Zoning-PDF",
        "quote": "Within the M-SVMS District, permitted uses shall be for the following:",
        "section": "Sec. 35-534"
      },
      "quote_verified": true,
      "notes": "Lead-in of Sec. 35-534 (Division 14); its list includes the bullet 'Data centers'. Sec. 35-142 standards do not apply in M-SVMS, which has its own data center standards."
    },
    {
      "id": "warrenton-i-datacenter",
      "jurisdiction_id": "us-5183136",
      "district_code": "I",
      "use_class": "datacenter",
      "expected_status": "prohibited",
      "basis": "code_text",
      "citation": {
        "url": "https://www.warrentonva.gov/DocumentCenter/View/3533/Article-2--General-Provisions-PDF",
        "quote": "Unless it is otherwise clear from the context of the lists or other regulations of this Ordinance, uses not specifically listed are prohibited.",
        "section": "Sec. 2-10"
      },
      "quote_verified": true,
      "notes": "Neither the I district by-right list (Sec. 3-4.12.2) nor its special use list (Sec. 3-4.12.3) in the July 2026 Article 3 names data centers, after the town removed them in July 2025. Article 12 still defines 'Data Center', so the use is named in the code and cannot be published as unlisted (the absence gate would hit the definition). Recorded as prohibited: a defined use the code lists in no district, under a clause that makes unlisted uses prohibited. The alternative reading is unlisted with unlisted_rule prohibited_by_default."
    },
    {
      "id": "fauquier-bp-datacenter",
      "jurisdiction_id": "us-51061",
      "district_code": "BP",
      "use_class": "datacenter",
      "expected_status": "permitted",
      "basis": "code_text",
      "citation": {
        "url": "https://www.fauquiercounty.gov/home/showpublisheddocument/33509/639106521845230000",
        "quote": "A data center use shall only be located in a Service District when proposed in the Business Park District.",
        "section": "Article 3, footnote 25"
      },
      "quote_verified": false,
      "notes": "Permitted with conditions (recycled-water cooling, new power lines underground, Service District only). Quote not verified: the county site refuses automated fetches (HTTP 403 bot wall), so the text was not fetched in this step. The use-table row is an image with no text layer."
    },
    {
      "id": "douglas-oi-datacenter",
      "jurisdiction_id": "us-13097",
      "district_code": "OI",
      "use_class": "datacenter",
      "expected_status": "conditional",
      "basis": "code_text",
      "citation": {
        "url": "https://www.douglascountyga.gov/DocumentCenter/View/14787",
        "quote": "Computing Infrastructure Providers, Data Processing, Web Hosting, and Related Services",
        "section": "Table 2.2"
      },
      "quote_verified": true,
      "notes": "NAICS 518210 row of Table 2.2 shows S (Use Requires Special Use Approval) in the OI, LI, LI-R and HI columns, read from the rendered page; Sec. 352 adds standards."
    },
    {
      "id": "douglas-li-datacenter",
      "jurisdiction_id": "us-13097",
      "district_code": "LI",
      "use_class": "datacenter",
      "expected_status": "conditional",
      "basis": "code_text",
      "citation": {
        "url": "https://www.douglascountyga.gov/DocumentCenter/View/14787",
        "quote": "Computing Infrastructure Providers, Data Processing, Web Hosting, and Related Services",
        "section": "Table 2.2"
      },
      "quote_verified": true,
      "notes": "NAICS 518210 row of Table 2.2 shows S (Use Requires Special Use Approval) in the OI, LI, LI-R and HI columns, read from the rendered page; Sec. 352 adds standards."
    },
    {
      "id": "douglas-li-r-datacenter",
      "jurisdiction_id": "us-13097",
      "district_code": "LI-R",
      "use_class": "datacenter",
      "expected_status": "conditional",
      "basis": "code_text",
      "citation": {
        "url": "https://www.douglascountyga.gov/DocumentCenter/View/14787",
        "quote": "Computing Infrastructure Providers, Data Processing, Web Hosting, and Related Services",
        "section": "Table 2.2"
      },
      "quote_verified": true,
      "notes": "NAICS 518210 row of Table 2.2 shows S (Use Requires Special Use Approval) in the OI, LI, LI-R and HI columns, read from the rendered page; Sec. 352 adds standards."
    },
    {
      "id": "douglas-hi-datacenter",
      "jurisdiction_id": "us-13097",
      "district_code": "HI",
      "use_class": "datacenter",
      "expected_status": "conditional",
      "basis": "code_text",
      "citation": {
        "url": "https://www.douglascountyga.gov/DocumentCenter/View/14787",
        "quote": "Computing Infrastructure Providers, Data Processing, Web Hosting, and Related Services",
        "section": "Table 2.2"
      },
      "quote_verified": true,
      "notes": "NAICS 518210 row of Table 2.2 shows S (Use Requires Special Use Approval) in the OI, LI, LI-R and HI columns, read from the rendered page; Sec. 352 adds standards."
    },
    {
      "id": "douglas-ag-datacenter",
      "jurisdiction_id": "us-13097",
      "district_code": "AG",
      "use_class": "datacenter",
      "expected_status": "prohibited",
      "basis": "code_text",
      "citation": {
        "url": "https://www.douglascountyga.gov/DocumentCenter/View/14787",
        "quote": "Use is not Allowed if no symbol appears",
        "section": "Table 2.2"
      },
      "quote_verified": true,
      "notes": "NAICS 518210 row of Table 2.2 is blank in this column; the table key says a blank means the use is not allowed (spec 3.1 rule 1)."
    },
    {
      "id": "douglas-r-a-datacenter",
      "jurisdiction_id": "us-13097",
      "district_code": "R-A",
      "use_class": "datacenter",
      "expected_status": "prohibited",
      "basis": "code_text",
      "citation": {
        "url": "https://www.douglascountyga.gov/DocumentCenter/View/14787",
        "quote": "Use is not Allowed if no symbol appears",
        "section": "Table 2.2"
      },
      "quote_verified": true,
      "notes": "NAICS 518210 row of Table 2.2 is blank in this column; the table key says a blank means the use is not allowed (spec 3.1 rule 1)."
    },
    {
      "id": "douglas-r-ld-datacenter",
      "jurisdiction_id": "us-13097",
      "district_code": "R-LD",
      "use_class": "datacenter",
      "expected_status": "prohibited",
      "basis": "code_text",
      "citation": {